Windows 10 where to find Autoplay in Settings?, Devices, Autoplay settings can also be configured via a drives properties dialog box.
Kind of virus identification that looks at actions of what programs are doing?, heuristic, uses knowledge of the sort of things that viruses do to try to spot (and block) virus-like behavior
Defender Antivirus can be disabled temporarily by toggling what button?, real-time protection, It will re-activate itself after a short period.
Quickly launch Windows Defender Firewall settings?, firewall.cpl, Then 'Advanced Settings' to modify Inbound and Outbound rules (wf.msc) (Update & Security->Windows Security->Firewall & Network Protection)
Quickly launch Advanced Firewall settings in Windows?, wf.msc, From top of tree 'Status Page' -> 'Windows Defender Firewall Properties' for specific options for each Network Profile
Windows: What Tab to encrypt contents of a File or Folder; from the Properties dialog?, Advanced, There is 'Encrypt Contents to Secure Data' option.
During BitLocker setup what is also generated?, Recovery Key, This should be stored on removable media or written down and stored securely.
What is the default minimum password length enforced by Windows?, 0, use secpol.msc or gpmc.msc for domain (can also get to it in gpedit.msc but secpol.msc is more focused)
Account management policy that can protect against password guessing attacks?, lockout, disables the account after a number of incorrect sign-in attempts
Software not necessarily malicious but with increased privacy risks is often categorized (by anti-malware) as?, PUA, Potentially Unwanted Application; such as Adware Browsers bundled with other software or rarely on OEM PC's
Thing that add or change a browser feature via its application programming interface (API), Extension, The extension must be granted specific permissions to make configuration changes. Could run scripts to interact with the pages you are looking at.
Browser add-on that play or show some sort of content embedded in a web page, Plug-In, plug-ins have been associated with numerous vulnerabilities over the years and are now rarely used or supported
how to get to settings through URL in Firefox?, about:preferences, #general / #home / #search / #privacy / #sync / #experimental / #moreFromMozilla ; add to go
how to get to settings through URL in Chrome?, chrome:settings, Privacy & Security -> Site Settings -> Notifications {where you can pick which sites can send notifications}
how to get to settings through URL in Edge?, edge:settings, Profiles/Privacy;search; and services/Appearance/Default Browser/Start; home; and new tab page; and more!
Quick run 'Internet Properties' Applet, inetcpl.cpl, They says 'Internet Options' in in the course sometimes. It the old style one.
Advanced settings for Google Chrome?  chrome://?, flags, Gets to a LONG list of 'Experimental' features you can enable. chrome://flags
Advanced settings for Firefox? about:?, config, Click 'Show All' for list of all kinds of settings you can change. about:config
Besides clearing cache and browsing data how else can you manage history?, incognito, no cookies; browsing history; form fields; passwords; or temp files will be stored when the session is closed
Minimum length of passphrase for PSK authentication to mitigate risk of cracking?, 14, This is converted to a type of hash value; referred to as the pairwise master key (PMK)
Trait of Trojans that add themselves to startup, persistence, So it runs when the computer starts or the user signs in
malware concealed within an installer package for software that appears to be legitimate, Trojan, The malware will be installed alongside the program and execute with the same privileges.
Malware that replicates between processes in system memory rather than files on disk, Worm, Worms can also exploit vulnerable client/server software to spread between hosts in a network.
malicious code that uses the host’s scripting environment, Fileless Malware, As it may be disguised as script instructions or a document file rather than an executable image file; this type of malware can be harder to detect.
Another name for malware that implements a Backdoor, Remote Access Trojan, RAT: threat actor must establish a connection from the compromised host to a command and control (C2 or C&C) host or network
Malware that mess with browser; let on cookies; change search; bad pages?, Spyware, Also may monitor local app activity; take screens; use recording devices or redirect to spoofy sites.
If you suspect a malware infection; Next step? - do this:, quarantine, Slow performance; App crashes; AV-Updates-Firewall stop working; File Sys Anomolies/Access Denied errors
Steps 3/6 of Best Practices for malware removal relate to?, System Restore, Disable in Step 3; (4 - Remediate) / (5 - Schedule Scans & run Updates) ; Enable System Restore in Step 6 (other backups too like File History)
If a user experiences redirection; check what?, hosts file, HOSTS is a legacy means of mapping domain names to IP's; Popular target for Malware; Also verify DNS servers configured.
Malware on the host or some type of evil-twin AP intercepts request and presents its own spoofed certificate, On-Path, On Path attack by a Malicious Proxy; may or may not get warning; malware in the middle intercept and modify traffic that would normally be encrypted.
Open command prompt during Windows Preinstall Environment - hotkeys?, Shift-F10, Many antivirus companies make bootable rescue disks that are basically Windows PE with their scanning software pre-loaded.
a particularly popular way to disguise a Trojan, Rogue Antivirus, a website would display a pop-up disguised as a normal Windows dialog box with a fake security alert
means that the A-V software intercepts an OS call to open a file and scans the file, on-access, This reduces performance somewhat but is essential to maintaining effective protection against malware.
If real time protection for Windows Defender won't turn on - check what?, Services, Windows Defender Antivirus Service; but think Services for many Windows components not running; like spooler!
Best for a password is to be, Memorable Phrase, a long and memorable passphrase is even more recommended than a short jumbled mess! Users might write those down cuz they are a pain.
How are app updates notified to user on iOS?, app store icon, and delivered via the Updates page in the app store; Updates for iOS are delivered via Settings > General > Software Update
How are updates delivered on Android phones?, Notification Bar, You can also go to Settings > System > Advanced > System updates.
On mobile devices how does a "No-Root" firewall work, local vpn, Most firewall monitor app activity and prevent connections to ports or IP addresses; Most need root but installing an app with root access is challenging.
COBO Meaning?, Corp owned Biz Only, Corporate Owned; Business Only: The device is the property of the company and may only be used for company business.
COPE Meaning?, Corp owned Pers Enabled, Corporate Owned; Personally Enabled: Chosen/Supplied/Owned by company; Employee may use for personal things (within AUP)
AUP Meaning?, Acceptable Use Policy, is a set of rules that outline how a service or technology can be used.
CYOD Meaning?, Choose Your Own Device, Supplied/Owned by company but employee get to pick from list; Usually personally enabled.
Configure in EMM to pick/choose/enforce security requirements for Mobile Devices:, Profile, A profile of security requirements and policies through Azure EMM for example
in iOS what options will give data in apps a second round of encryption?, Data Protection, Uses a key derived from and protected by the user's credential. Not all user data is encrypted using the "Data Protection" (eg. SMS/Contacts/Pictures)
Z-Wave or Zigbee what even are they, wireless mesh, These wireless standards use less power and make it easier for smart devices to forward data between nodes
Main risk from smart device placement in workplace?, Shadow IT, A vulnerability in the device would let it maybe be used to access the network!
Something that home-intended IoT devices can suffer from?, Weak Defaults, There may be recommended steps to secure the device and procedures to apply security patches that the customer never takes.
iOS where swipe to get Control Center?, Top Right, can be accessed by swiping from the top-right corner (newer models) or bottom of the screen.
iOS- where is factory reset?, General, General page in settings
Android- Where is factory reset on 'Stock Android'?, System-Advanced, do not attempt a factory reset within 72 hours of changing your account password
In iOS; a manual ROTATE control can be added via the AssistiveTouch option which is enabled via, Accessibility, When you turn on AssistiveTouch; you see a button appear onscreen; By default; tapping the button once opens the AssistiveTouch menu.
Where is Force Stop on Android?, Settings-Apps, To Force Stop an App on Android: Settings->Apps and then Click any App and option is bottom right.
In iOS; clearing an app from the multitasking list also does what?, Force Stop, Either swipe up or double tap the physical Home button; then swipe the app up off the screen.
in iOS how to bring up Multitask List? (physical home button), Double Tap, or swipe up if there is not a physical button.
If a Mobile App is acting up and Force Quitting doesn't help?, App Cache, Clear from within the app or (in Android) using the Clear Cache option under App info.
What feature allows Private App Distribution on Apple?, Business Manager, Allows an MDM suite to push apps from the private channel to the device.
What feature allows Private App Distribution on Android?, Managed Google Play, Allows an MDM suite to push apps from the private channel to the device.
Installing untrusted .APK files with 'Unknown Sources' disabled is known as, Sideloading, Android allows for selection of different stores and installation of untrusted apps from any third party if this option is enabled by the user
Email & any other apps using this setting get an extra round of encryption on mobile, Data Protection, Using a key derived from and protected by the user's credential. Does not encrypt SMS; Contacts or Pictures
iOS: a means of installing apps from outside the App Store without having to jailbreak, Developer Tools, XCode is the main one used for iOS development
What TCP port does VNC use?, 5900, macOS 'Screen Sharing' feature is based on VNC and IS encrypted (not all VNC's are)
What option protects the RDP server against denial of service attacks? (Acronym), NLA, Network Level Authentication - newer RDP clients should have - makes them auth before commiting resources.
MSRA Meaning?, Microsoft Remote Assistance, +Chat Feature & Request Remote Control; mrsa.exe use ephemeral ports 49152-65535; *Password protected invitation file*
How to launch Quick Assist in Windows 10? (hotkeys), Ctrl-Win-Q, an alternative to msra.exe; Quick Assist works over the encrypted HTTPS port TCP/443 (they say CTRL-START-Q)
Tool that can distinguish between client accts for providing/recording/reporting billable support, RMM, Remote Monitoring & Management; principally designed for use by managed service providers (MSPs)
Suite designed for control & authorization of devices within a single organization, UEM, Unified Endpoint Management; Any of: Agents for Security/Information/OS Version checking/Push Updates/Live Chat/Remote Shell
EDR Meaning (in security), Endpoint Detection and Response, Software agent that collects system data and logs for analysis by a monitoring system to provide early detection of threats.
Challenge of knowing each host on network authorized and secure?, Network Visibility, Generally best to utilize Desktop Management & Remote Monitoring Tools
What RDP client does Ubuntu use for connecting to remote machines?, Remmina, It allows connection only from a user on Linux to control a RDP server on another PC
How to restore a single file with File History (what tab?), Previous Versions, Previous Versions tab in file properties or the File History applet.
Win10: Where find "Files Backup" option in Settings?, Update & Security, 'File History' option or link to 'Backup & Restore (Windows 7)'. (course says: Settings>Update & Security>Backup)
creates a new full backup from the previous full and incremental backups, Synthetic,  not generated directly from the original data but instead assembled from other backup jobs
Fancy term for a Malicious Data Breach?, exfiltration, Data Exfiltration; breach of regulated data must normally be reported to the regulator and to individual persons impacted
contains codes that allow the subject information to be reconstructed by the data provider, de-identified, An anonymized data set is one where the identifying data is removed completely
IRP Meaning, Incident Response Plan, Larger organizations will provide a dedicated Computer Security Incident Response Team (CSIRT)
Uses the capabilities of self-encrypting drives (SEDs) as a reliable sanitization method, Instant Secure Erase, or Crypto Erase. HDDs and SSDs. a SED encrypts all its contents by using a media encryption key (MEK).
how to shebang bash for a script?, #!/bin/bash, Linux shell scripts uses .sh extension by convention.
What are the prebuilt modules in Powershell called?, cmdlets, and Powershell files are identified by the .PS1 extension
What interpreter executes VBScript?, wscript.exe, Handles: VBScript (.VBS) and Javascript (.JS); .wsf files support both; cscript.exe shows output in command prompt
In what way is JavaScript supported on macOS? (Acronym), JXA, Javascript For Automation (There is also AppleScript)
How to run the Python IDLE Shell, pythonw.exe, Windows python scripts associated with .pyw; IDLE = Integrated Development and Learning Environment
How to do a for sure restart in PowerShell? (ignore any warning), Restart-Computer -Force, in bash use 'shutdown -r'
How to map a drive in PowerShell?, New-PSDrive, New-PSDrive -Name "L" -Persist -PSProvider FileSystem -Root "\\MS10\LABFILES" (error check to see if it exists first)
How to run a 'Windows Installer' in a script?, msiexec, msiexec /i 7z2409-x64.msi /qn    (/a for admin install; /qn = no UI during the installation process)
Powershell cmdlet that gives you more control over install process?, Start-Process, $process = Start-Process -FilePath "msiexec" -ArgumentList "/i C:\temp\software.msi /qn" -Wait -PassThru (then u can look at $process for info)
Windows: can be called from a batch file to perform typical update tasks, wusa.exe, (Win Update Standalone) Powershell: PSWindowsUpdate module; contains numerous cmdlets for managing the update process.
when introducing a script; the script and output should be subject to:, access controls, Also any system reconfiguration should be properly change managed.
What to do before deploying a script?, test in sandbox, and remember that security software may affect operation of some scripts
RDP to infected machine can put credentials at risk! What can help prevent?, RDPRA, RDP restricted admin (RDPRA) mode is one means of mitigating this risk.
How to toss output into the void in Bash?, &>/dev/null, redirects output to the null device
What standard governs the processing of credit card transactions? (acronym), PCI DSS, Payment Card Industry Data Security Standard
uses GPS and/or high accuracy to calculate a device's position on a map, Location Service, can be used with a locator application to find the device if it is lost or stolen
mobile symptom of overheating; low battery charge; or faulty battery or other hardware, random reboots, You can use the Settings menu to check battery health; and there are third-party diagnostic apps that can report hardware faults
Where to configure iOS feature that allows file transfer between iOS and macOS devices? Settings-, General-Airdrop, The sender must be listed in the recipient’s contacts list; or AirDrop must be configured to receive files from everyone. (Uses Bluetooth)
Step-by-step list of the actions that must be completed for any given task to comply with policy, standard operating procedure, SOP: Most IT procedures should be governed by SOPs. A policy is an overall statement of intent.
If there is an area of Policy too complex for an SOP; possibly use:, Guidelines, for situations not fully assessed; too complex; or areas where deviation from procedure may be warranted
CRM database meaning?, Customer relationship management, It may be possible to link a ticket to an employee database or CRM.
First two basic details to capture after receiving a ticket? ?/?, customer/device, might be possible to link ticket employee/customer DB & device to a service tag or AssetID.
Ticket Management: What do after users description of issue and your clarifying questions?, categorize, 3. The agent categorizes the support case; assesses how urgent it is; and determines how long it will take to fix.
Type of ticket likely to be generated internally?, Problem, Problems are causes of incidents and will probably require analysis and service reconfiguration to solve.
Type of ticket for errors and situations faced by users or customers?, Incident, Incidents may be further categorized by severity (impact and urgency); such as minor; major; and critical.
Type of ticket for provisioning things IT has an SOP for, Request,  New user accounts; purchasing new hardware or software; deploying a web server; and so on
A good alternate or way to supplement ticket categorization, keyword tags, A keyword system is more flexible but does depend on each technician tagging the ticket appropriately.
What might be a good idea to include with Severity classification?, notification,  a notification system to make senior technicians and managers immediately aware of major and critical incidents as they arise.
Two key aspects to keep in mind when writing notes on Tickets ?/?, Clear/Concise, State the minimum of fact and action required to describe the issue or process.
What is another term for an Incident Report?, After-Action Report, (AAR) or "lessons learned"; often involves customer/tech/manager/stakeholder; to analyze and prevent repeat
Word to describe deployed/spare physical systems & components on hand, Tangible, and Intangible refers to things like software licenses or data assets like IP (Intellectual Property)
Asset DB Software that scan network/query hardware and software config & monitoring data, Inventory Management Suite, Bit different than an Asset-Management Database System that simply stores various info on assets.
Docs showing how net nodes are connected or logically identified and connected, Topology Diagram, A [Network Topology Diagram] can be used to model physical and logical relationships at different levels of scale and detail
shows the cabling layout between hosts; wall ports; patch panels; and switch/router ports, Schematic Diagram, Schematics can also be used to represent the logical structure of the network in terms of security zones; virtual LANs (VLANs) and IP subnets.
The Asset Procurement Life Cycle (Pnemonic), ChaProDeMaDi, Change Procedures; Producrement; Deployment; Maintenance; Disposal
What does ITIL Stand for (The IL), Infrastructure Library, A popular documentation of good and best practice activities and processes for delivering IT services
What is a Configuration Item (CI) in ITIL?, Managed IT Asset, Any component (hardware; software; documentation) that requires formal change control and tracking procedures to deliver IT services. Eg: servers; applications; network devices; and even important documents.
Settings that should be applied to the CI to ensure secure and reliable operation, Configuration Baseline, Approved template of security and operational settings that should be applied to a Configuration Item to ensure it operates securely and reliably.
Basis for comparison for ongoing monitoring of a CI is called?, Performance Baseline, Documented measurements of how a Configuration Item should perform under normal conditions (speed; capacity; response times).
The need to change is often described as one of two things ?/?, reactive/proactive, A change request is generated when a fault needs to be fixed; new business needs or processes are identified; or there is room for improvement in an existing SOP or system.
RFC Meaning?, Request For Change, Need or reasons for change and the procedure for implementing the change are captured in a request-for-change (RFC) form.
Two things that change request documentation should include: ?/?, purpose/scope, Purpose: Case for making the change and the benefits that will accrue / Scope: # of devices/users/customers affected; timescale; success/fail metrics
sets out what someone is allowed to use a particular service or resource for (Acronym), AUP, Acceptable Use Policy: May be used in dif contexts; eg. how employees use eq. and services such as telephone or Internet access
Upon receiving and acknowledging a customer request be sure clarify 3 things: Expectations/?/?, concerns/constraints, Customer concerns about cost or the impact on business processes / Your constraints—time; parts; costs; contractual obligations; and so on.
For a Repair the customer will need a ticket-tracking number and what else?, RMA, Returned-Merchandise Authorization (RMA); also clear instructions how to pack it.
Windows feature allowing rapid search of apps; data folders; messages and the web, Instant Search, More specifically refers to the search indexing feature that makes file searches faster
Once you have a sense what the customer's problem is; how to clarify?, closed questions, clarify customer statements and prove or disprove your perception.
Important thing in demonstrating attention and empathy to customers?, Active Listening, Begin with open ended questions and narrow with closed-questions.
What should you avoid being when dealing with an angry customer ?/?, Dismissive/Judgemental, Try to calm the customer and move support to positive troubleshooting diagnosis and activity.
Two types of fire extinguishers to use for electrical fire ?/?, CO2/Powder, CO2 usually has Black label (or Red/White); Dry Powder can be used but can damage electronic equipment.
Why not use a Domestic Vacuum to clean PC components?, static, Use a PC vacuum cleaner or natural bristle brush for internal components like Motherboard/Adapter Cards or Fan Assembys
Light Pink or Blue packaging that reduces static in general area, Dissipative, This is used to package non-static-sensitive components packed in proximity to static-sensitive components.
Less bad than a surge/spike but can still cause a PC to power off?, under-voltage, Devices with large motors require high-starting; or inrush; current. This might cause the building supply voltage to dip briefly.
Max amount of the rated Amperage you should use on on a surge protector? ?%, 80, For example; the devices connected to a 15 A protector should be drawing no more than 12 A; minding total building power also.
Conversion factor from Watts to VA?, 1.67, VA rating is the maximum load the UPS can sustain. 10 W router & two 250 W computers; VA is (10 + 250 + 250) * 1.67 = 852 VA >> a 1K UPS should suffice.
The strength of the UPS batteries is measured in?, Amp Hours, Amp hours is like how many gallons your gas tank holds (raw capacity) vs Runtime which is how far you can actually go (minutes)
The total amount of energy the surge protector can absorb (basically its HP)?, Joules Rating, 600 joules or more offering better protection. Each surge event will degrade the capability of the suppressor.
The level at which the protection circuitry in a surge protector will activate, Clamping voltage, with lower voltages (400 V or 300 V) offering better protection.
Two situations besides just working with; where you would consult MSDS ?/?, Accident/Disposal, ingredients; health hazards; precautions; first aid; spill/leaks procedure; disposal process
RMA Meaning?, return merchandise authorization, need clear instructions how to pack and return the item to a repair center along with a ticket-tracking number and return merchandise authorization
HBA Meaning?, Host Bus Adapter, A Fibre Channel HBA enables connectivity and data transfer between devices in an FC-based storage area network (SAN).
evidence cannot be seen with the naked eye, Latent, rather; it must be interpreted using a machine or process.
PHI Meaning?, Protected Health Information, Industry standard concerning complicance data for healthcare-related information.
Frameworks for security controls are established by organizations such as the (Acronym), NIST, National Institute of Standards and Technology (NIST)
Can be affixed to a device as a barcode label or radio frequency ID (RFID) sticker, Asset Tag, An RFID tag is a chip programmed with asset data. When in range of a scanner; the chip powers up and signals the scanner.
An asset record for software should include (in addition to what a regular asset would), Licensing Details, with device/user allocations and limits. Regular stuff is invoice and warranty/support contract.
Besides virus defs and scan engine updates what should regularly be checked for AV?, authorized exclusions, and that it is enabled; obviously
Where to find 'Sign-In Options' in Windows 10?, Accounts, Use a fingerprint reader or PIN to access the computer rather than a password. Dynamic lock set here also (see phone far = lock)
In Windows 10 where would you go to join PC to an Azure AD Domain?, Access Work or School, From Accounts->Access Work or School: Join the computer to a centrally managed domain network (asks for e-mail account)
In Windows 10 where is Sync Settings/Windows Backup option?, Accounts, Accounts->Windows Backup (or Sync Settings according to course); Options greyed if local account.
