Location Settings inside which Settings screen, Privacy, Many web browsers allow location on a per-site basis also
Run command: Quick Access to create a user account (Admin Tools screen), netplwiz, or 'control userpasswords2'/'control userpasswords' will get you to users basic control panel app.
Extra key to reverse an alt-tab, shift, alt-shift-tab is correct
major releases that introduce new features and improvements of Windows, Feature Update, Feature updates are essentially new versions of Windows; offering a comprehensive refresh of the operating system.
ACPI meaning?, Advanced Configuration and Power Interface, Designed to ensure software and hardware compatibility for different power saving modes
ACPI S4 relevant filename, hiberfil.sys, Hibernate mode/Suspend to disk; hiberfil.sys is created in the root of the boot volume. ACPI defines different S# sleep/power states
Apps that install to AppData folder and do not need credentials to install, user-context, They do not install in either the System folders or Program Files folders.
Where to change date/time formats?, region, Time & Language->Region
Run command for Defrag & Optimize Drives, dfrgui.exe, Found in Administrative (Windows) Tools in Control Panel
Run command for Computer Management, compmgmt.msc, Tasks; Shared Folders; Performance; Dev Manager; Users/Groups; Disks; Services; etc..
Run command for Disk Cleanup, cleanmgr.exe, Regain disk capacity by deleting unwanted files; tracks files that can be safely erased to reclaim disk space.
Run command for Event Viewer, eventvwr.msc, Review system; security; and application logs.
Run command for AD Group Policy Management, gpmc.msc, Create and manage Group Policy Objects from Domain Controller
Run command for Local Security Policy, secpol.msc, View and edit the security settings. Not available on Home edition.
Run command for Resource Monitor, resmon.exe, Old school resource monitor
Run command for Performance Monitor, perfmon.msc, Performance statistics and logging (also perfmon.exe)
Run command for Task Scheduler, taskschd.msc, Run software and scripts according to calendar or event triggers.
Run command for Network Adapters, ncpa.cpl, Skips the 'Network and Sharing Center' straight to adapters.
Run command for Device Manager, devmgmt.msc, Driver Details / Update/ Roll Back / Disable / Uninstall
Run command for Disk Management, diskmgmt.msc, Initialize; (Re)Partition; Format; Configure Dynamic Disks/RAID replaced by Storage Spaces now.
Run command for Local Users and Groups, lusrmgr.msc, Not available on Home Editions
Run command for Certificate Manager for Local User, certmgr.msc, A digital certificate is a means of proving identity; validity guaranteed by the issuing certification authority (CA).
Run command for Certificate Manager for Computer, certlm.msc, Trusting an unsafe CA raises critical security vulnerabilities
Run command for Registry Editor, regedit.exe, It's the registry editor. HKEY_CLASSES_ROOT YALLLLLLL
Run command for RDP Client, mstsc.exe, Microsoft Terminal Services Client (mstsc.exe)
Run command for creating a bootable USB recovery drive?, recoverydrive, Creates a bootable USB drive that can be used to troubleshoot and recover Windows when it won't start
Run command for Backup & Restore (Windows 7), sdclt.exe, Allows you to create system backups; restore from previous backups; and create system repair discs or complete system images
Screws with USB Power and can interrupt use, Selective Suspend, Power Options -> Change Plan Settings -> Change Advanced Power Settings
Run command for Power Settings Control Applet, powercfg.cpl, or ms-settings:powersleep for the new settings version
Windows 11 where to find Taskbar in Settings (menu), Personalization, Change alignment under Taskbar Behaviors
Where to find Optional Updates in Windows 11 Update Settings, Advanced Options, In Windows 10 it says 'View Optional Updates' right under the 'Check for Updates' button
In Windows 11 the Update and Security button became what?, Privacy and Security, Privacy merged with security and Windows Update became it's own option.
What was 'Accessibility' called win Windows 10?, Ease of Access, Ease of Access options changed to Accessibility in Windows 11
WSL Meaning, Windows Subsystem for Linux, Allows the installation of a Linux distribution and the use of Linux applications.
Low disk warning *MB* remaining, 200, And under 20% capacity may affect performance.
Automates disk cleanup activities, Storage Sense, System->Storage->Storage Sense: Time to run and clear recycle/downloads folders
Run command for Local Security Policy editor, secpol.msc, Can be used to modify security settings specifically.
Run command for Group Policy Editor, gpedit.msc, Provides a more robust means of configuring many of these Windows settings than editing the registry directly.
Command to make a custom management console, mmc, (mmc.exe) Most MMC snap-ins can be used to manage either the local computer or a remote computer.
Run command to get to System Information, msinfo32.exe, system resources; firmware and OS versions; driver file locations; env. variables; network and so on.
Fast Task Manager hotkeys Ctrl+(?/?), Shift/Esc, also it is 'taskmgr.exe' or right click task bar or start button. or ctrl+alt+delete. literally it's everywhere.
If *this* increasing and disk time is high then you have a disk problem, Average Disk Queue Length, The number of requests outstanding on the disk at the time the performance data is collected.
Overall good indicator counter for how busy a disk is, % Disk Time, if the average exceeds 85% for a sustained period you may have a disk problem.
Counter that indicates hard faults in memory, pages/sec, The number of pages read from or written to disk to resolve hard page faults. This means your system is using the paging file.
ETW Meaning, Event Tracing for Windows, ETW is a mechanism that allows applications and services to record detailed information about their activities
Where is the boot log saved (msconfig setting), %systemroot%\ntbtlog.txt, NT Boot Log: not shown in event viewer!
BCD Meaning, Boot Configuration Data, \boot\bcd on the system (EFI) partition.  bcdedit or msconfig boot tab to edit.
Where are list of configurable properties in the properties screen of a Device Manger item?, Advanced, Many things here such as Speed & Duplex for a NIC.
What tab is 'Scan for Hardware Changes' under in Device Manager?, Action, Use this if you uninstalled a device and want to reinstall it.
What year did apple switch to a seperate iPadOS for tablets?, 2019, Better support for multitasking (using more than one app at once) and the Apple Pencil stylus device.
Make System File Checker scan on the next startup, /scanonce, Schedules a scan when the computer is next restarted.
Make System File Checker scan every time the computer boots, /scanboot, Schedules a scan that runs each time the PC boots. (sfc /revert will stop this)
Where is the version controlled backup of system files for sfc? (folder name), WINSxS, System files (and shared program files) are maintained; and version-controlled in the WINSxS system folder.
Only check for logical errors on hard disk file system, chkdsk /f, CHKDSK /R begins by performing the same function as CHKDSK /F and attempts recovery of bad sectors. (“CHKDSK /F /R” is redundant)
Skip doing scan for bad sectors when running format, /q, Quick Format will skip the scan; both standard and quick do leave sectors un-scrubbed however.
Where does an elevated command prompt begin? %SYSTEMDRIVE%:\?, Windows\System32, Non-elevated will begin in %USERPROFILE% (eg C:\Users\Jim)
Registry hive: Contains file name extension associations and registration info for shared software components, HKEY_CLASSES_ROOT,	Primarily intended for compatibility with the registry in 16-bit Windows.
Registry hive: contains information about the current hardware profile being used by the system., HKEY_CURRENT_CONFIG, This profile includes settings related to display resolutions; color profiles; printer configurations; and other hardware-related options.
a set of formal descriptions that provide a standard for the design of operating systems compatible with Unix, Posix, NTFS is Posix compliant supporting case-sensitive naming. (Portable Operating System Interface)
Maximum possible NTFS Volume size in recent Windows feature updates, 8 Petabytes, Between 137 GB and 256 Terabytes listed previously.
FAT32 maximum Volume size/File Size, 2TB/4GB, FAT32 is a variant of FAT that uses a 32-bit allocation table; max file size is 4GB minus 1 byte.
ExFAT (64-bit version of FAT) recommended maximum Volume size?, 512TB, There is also support for access permissions but not encryption. Excels in portability and compatibility across various operating systems
The Linux file system that added support for journaling., Ext3, Max File Size: 2TB ; Max Volume Size: 32TB
Linux implementation of FAT with long filename support, VFAT, Virtual FAT; It's not a distinct file system; just a driver label.
Linux protocol that can be used to share or remotely mount files/folders (Acronym), NFS, Network File System
The main compatibility issues for a web application ?/?, touch/size, supporting a touch interface and a very wide range of display resolutions on the different devices that might connect to it.
This disk management feature allows space on multiple physical disks to be combined into volumes., Dynamic Disks, Windows Home editions do not support dynamic disks or encryption; it is depreciated in favor of 'Storage Spaces' anyways (which does work on Home).
Feature update where 32-bit stopped shipping with new OEM installs?, 2004, April 2020: from then on new versions only ship for 64 bit hardware (but old PC's still got updates)
Feature update that introduced Dark Mode (Windows 10), 1607, Released August 2; 2016
FPP Meaning, Fully Packaged Product, Each box contains a copy of the software that you manually install on your computer and one license.
Version of Windows that supports more RAM and advanced hardware such as persistant NVDIMMs RAM, Pro for Workstations, NVDIMMs integrate non-volatile NAND flash memory with dynamic random access memory (DRAM) and dedicated backup power on a single memory subsystem.
App Control Windows Enterprise feature is called, AppLocker, (ENTERPRISE FEATURE) AppLocker helps you control which apps and files users can run.
Fancy persistent VPN on Windows Enterprise only, DirectAccess, (ENTERPRISE FEATURE) although it is now depreciated and MS recommends AlwaysOn VPN.
MDOP Meaning? (Microsoft) ???, Desktop Optimization Pack, (ENTERPRISE FEATURE) App-V; User Experience Virtualization (UE-V); Bitlocker Admin & Monitoring; Adv. Group Policy Managmt; Diag. & Recovery Toolkit (DaRT)
Processor limit of Pro & Education Windows editions: Procs/Cores, 2/128, Enough for most desktops and workstations
Processor limit for Pro for WS and Enterprise Windows Editions: Procs/Cores, 4/256, Designed for high-end servers or workstations
RAM Limit for Pro and Education Windows editions (TB), 2, More than enough for most business-grade PCs
RAM Limit for Pro for WS and Enterprise Windows editions (TB), 6, Supports massive RAM for demanding workloads like VMs or scientific computing
Max RAM for Windows Home Editions (GB): 32-bit/64-bit, 4/128, 4 GB is the limit of 32-bit architecture; 64-bit removes that barrier and Home allows up to 128 GB
Maximum number of CPU cores allowed on Windows Home edition, 64, Limited to 1 physical CPU but supports lots of cores and HyperThreading
What does EFS stand for?, Encrypting File System, NTFS feature for encrypting individual files/folders; tied to user account; not available on Home edition
Protocol used by BranchCache to find peers with cached data, WS-Discovery, Also used in local discovery for devices like printers and smart TVs
What Linux distributions are subscription based ?/?, SUSE/Red Hat, SUSE (german acronym) loosely translates to 'software and system development'; SUSE Linux Enterprise Server = SLES
Linux distributions that are community supported?, Fedora Debian Mint Arch, Supported by volunteer communities; often cutting edge or customizable; no official enterprise support
What is a rolling release Linux distro? One that:, updates continuously, Always has latest software; no need for full OS reinstall; examples: Arch; openSUSE; Tumbleweed
What is a fixed release Linux distro? One that updates in:, versioned jumps, Receives updates within a version; major upgrades require reinstall or full upgrade; examples: Ubuntu; Debian
Windows Server 2019 and 2022 are optimized for use as a, Network Operating Systems, Typically; a NOS provides file-to-print services; directory services and security.
Devices running different operating systems need what in common to talk to each-other?, Network Protocols, This will allow data to be exchanged in a standard format.
RoboCopy: switch to Include Non-Empty directories, /s, Copies Subdirectories; but not empty ones. /E to include empty ones.
Robocopy: copy the 'fun' folder from current directory and ALL contents back one folder?, robocopy /e fun ..\fun, it will not create the folder for you - you must specify the folder name!
CMD: display directory contents ordered by last modified date?, dir /o:d /t:w, /t = time field [c : created on] [a : last access] [w : last modified] (use - prefix to reverse order)
DiskPart: Shrink a Volume, Shrink desired=, = the amount to shrink the volume by in MB > run this after 'select volume #'
DiskPart: Set a volume to letter L?, Assign Letter=L, you must 'select volume #' first; use 'Remove Letter=L' to remove a drive letter.
Script or config file to input the choices and settings that need to be made during Windows Installation, Answer File, Created with Windows System Image Manager (WSIM); uses XML format with .xml extension (unattend.xml)
What does DISM manage and service in Windows?, Windows images, Can add features to running system or customize install.wim offline
Option to make sure the PC uses external/hot-swappable HD or a flash drive as boot media, priority, Determines the order in which your computer's hardware checks for a bootable device.
For INTERNET boot; what must be supplied by the DHCP server, DNS Name, Of the installation server; To tell the PXE boot where to install from.
Another name for the boot sector at start of each primary partition on MBR, partition boot record, PBR: When a partition is marked as active; its boot sector is populated with a record that points to the OS boot loader.
Convert a disk from MBR to GPT name/win 10 feature update, mbr2gpt/1703, Backup first and remember to change to UEFI boot mode after.
What is the macOS file system called?, APFS, Apple File System; The file system used by macOS 10.13 or later. Journaling/Snapshots/Permission/Ownership/Encryption
a Windows command-line tool used to manage file and folder permissions, icacls, icacls img0.jpg /grant administrators:F (Integrity Control Access Control List)
Where are 32-bit shared system files stored in 64-bit versions of windows?, syswow64, %systemroot%\syswow64 - meaning Windows on Windows 64 bit emulation for 32 bit programs.
Installation package extensions for macOS ?/?, DMG/PKG, Disk Image (simple copy) vs Package file (complex install service / multiple folders)
Installation packages for Linux APT/YUM, DEB/RPM, APT (Debian/Ubuntu) uses .deb packages; YUM/DNF (Red Hat/Fedora) uses .rpm (redhat package manager).
How to verify authenticity of package in linux?, Hash, After download; you should generate your own hash of the package and compare it to the value published by the package maintainer.
What must be assessed and mitigated when depolying new apps?, potential impacts, It is important that the IT department maintains control and oversight of all third-party software installed to network hosts.
Cool term for unsanctioned software and devices, Shadow IT, But they raise substantial operational and business risks.
Three main App considerings regarding Impact to *Business* ?/?/?, Licensing/Support/Training, Who/how many can use with license? by machine or by user? Who supports/trains/maintains?
What can you use in Windows Domain to get a PC to remotely install an app? (Acronym), GPO, You can use Group Policy Objects to remotely install from a network folder automatically.
Method of automated deployment products like centrally managed antivirus use?, Push, Server or system pushes updates; configurations; or software to multiple client devices
Besides malware threats what could new software affect on a PC or Network?, Stability and Performance, Could also contain unpatched vulnerabilities; best to test in labe environment first; also compatibility issues
Linux bootloader, grub, Grand Unified Bootloader / grubx64.efi
Where does legacy BIOS firmware look for the MBR on the boot device?, first sector, The MBR then identifies the boot sector for the partition marked as active.
Boot manager file used by BIOS firmware (Windows), BOOTMGR.exe, Reads information from the BCD file; ID's operating systems installed on the computer; Loads WINLOAD.EXE boot loader.
Boot manager file used by UEFI firmware (Windows), bootmgfw.efi, Choose OS (if multiple) & then passes control to the boot loader (C:\Windows\system32\WINLOAD.EFI)
Name of the Boot Loader found stored in the system root folder on the boot partition?, WINLOAD, WINLOAD.EXE for BIOS/MBR and WINLOAD.EFI for UEFI/GPT (C:\Windows\System32) Boot Manager->Boot Loader
With BIOS boot; what to press to access Advanced Boot Options?, F8, Startup options are displayed automatically if the system cannot start the OS. Shift-Restart in UEFI systems.
Where to find 'Startup Settings' from WindowsRE main screen?, Troubleshoot-Advanced Options, Then click 'Restart' and it reboots to 'Startup Settings' Then press F4 to select Safe Mode; or choose another option.
MBR: WINLOAD then continues the Windows boot process by loading, NTOSKRNL.EXE, (Windows NT Operating System Kernel Executable); also HAL.DLL (hardware abstraction layer) and boot device drivers.
If the boot files are damaged what option on WinRE 'Troubleshoot->Advanced Options' to try repair?, Startup Repair, You can also launch 'System Restore' or 'System Image Recovery' or 'Troubleshoot->Reset This PC' to Refresh or Reset of Windows
Run command for System Restore tool, rstrui.exe, Opens directly to the pick a restore point dialog.
Command to (attempt to) add missing Windows to BCD, /rebuildbcd,
Attempt to repair the MBR from WindowsRE Command Line:, bootrec /fixmbr, Does not work with GPT partition - that requires the backup GPT or special tools
Attempt to repair the Boot Sector from WindowsRE Command Line:, bootrec /fixboot, Repair boot sector and boot files/BCD
Test if system is responsive with WINDOWS+CTRL+, SHIFT+B, WINDOWS+CTRL+SHIFT+B; Should hear a beep and display may reinitialize
Files not to copy when rebuilding a user profile NTUSER. ?/?/?, DAT/LOG/INI, NTUSER.DAT; NTUSER.DAT.LOG & NTUSER.INI <sometimes desktop can load slow due to a corrupt profile>
Hotkey during Windows Memory Diagnostics to configure test options, F1, From Administrative Tools or boot to the recovery environment. The computer will restart and run the test.
SFC switch to only check the Windows files; not repair, /verifyonly, you can do /scanfile or verifyfile to target specific file; /offbootdir and /offwindir for offline folders for repair
Built in tool in Windows that will periodically backup files, File History, Just type filehistory in run and click "Configure File History Settings" (Settings->Update & Security->Backup)
What verifies software is authentic and hasn't been tampered with?, digital signature, Digital Signature tab on properties; but still scan & test in a lab env if possible. And get from trusted source.
Where can you look for a catalog of tested devices and drivers for Windows?, HCL, Microsofts Hardware Compatibility List; also known as the Windows Logo'd Product List (LPL) catalog.
LLDP meaning (network - ???Protocol), Link Layer Discovery, Provides network mapping and discovery functions for networks without dedicated name servers. (LLTD: Link Layer Topology Discovery is MS version)
The Windows service that prompts to set a new networks 'Profile Type', Network Location Awareness, NLA: public is higher security / private means PC is discoverable and folder/printer sharing active (by default)
UNC Meaning (Windows), Universal Naming Convention, \\Host\Path ; where Host is the host name; FQDN; or IP address and Path is a shared folder or file path.
Setting on Windows to use on a WWAN connection with a data limit, Metered, (Network & Internet->{Type of Connection}->{Connection}->Metered) && (Network & Internet->Data Usage->Enter Limit)
Win10: In 'Network & Internet' what click to find 'Advanced Sharing Settings'?, Network & Sharing Center, Or Network & Sharing Center option in Control Panel; Then it's on the left side.
'No Internet Access': windows test to this address was unsuccessful, msftncsi.com, Checks that DNS resolves the IP address correctly. Could be a problem with the router; with DNS; or with both. (Microsoft Network Connectivity Status Indicator)
In addition to Netbios what else does /all add to ipconfig output ? ? ?, DHCP DNS MAC, MAC Address shows as 'Physical Address' and DHCP shows seperate than 'Default Gateway'
How to use IPConfig to show the DNS resolver cache?, /displaydns, This contains host and domain names that have been queried recently.
Command to clear any custom net/vpn adapter settings in Windows, Network Reset, The Network reset command is on the Settings > Network & Internet > Status page (tiny text down at very bottom).
Where is the Network Reset command found in Windows 10? (Network & Internet)->, Status, this will clear any custom adapter configurations and network connections; including VPN connections.
Ping this address to verify TCP/IP is installed and loaded correctly, loopback, 127.0.0.1 > The loopback address is a reserved IP address used for testing purposes.
Indicates no response to Address Resolution Protocol (ARP) probes locally. (Reply from ? Dst Host Unreachable), Sender IP, The most likely cause is that the destination host is disconnected or configured as non-discoverable. local network link issue!
Fancy alternative to tracert, pathping, It will trace the route and also do ping tests to determine the RTT and measure link latency.
If you identify or suspect a problem with name resolution; you can troubleshoot DNS with, nslookup, ex: nslookup -type=mx comptia.org 8.8.8.8; you can compare the results to those returned by your own name server.
netstat switch > includes UDP ports in the listening state?, -a, UDP 0.0.0.0:3702 *:* is a UDP listener (connectionless — no "established" state) (WS-Discovery in example)
netstat switch that shows the process that has opened the port?, -b, Alternatively; use the -o switch to list the (Owning) process ID (PID) rather than the process name.
netstat switch> displays ports and addresses in numerical format?, -n, Skipping name resolution speeds up each query. (n = numeric)
netstat switch> Ethernet statistics and Protocol statistic ?/?, -e/-s, Useful for tracking dropped packets or protocol-level errors; “e” for Ethernet; “s” for Stack (protocols)
FPP meaning, Full Packaged Product, FPPs are sold in stores in shrink-wrapped boxes.
AAA First A?,Authentication,Verifies identity—"Are you who you say you are?"; Account and Credentials /d
AAA Second A?,Authorization,Grants access—"What are you allowed to do?"; Access to resource controlled by ACL's /d
AAA Third A?,Accounting,Tracks activity—"What did you do and when?"; Logging /d
directory permissions in Windows: each user and security group account has a unique (acronym), SID, Security ID: the only identifier used in the underlying permission entries. Even account re-created with same name will have dif SID.
ACL: unless there is a rule specifying that access should be granted.., Implicit Deny, unless there is a rule specifying that access should be granted; any request for access is denied.
Prinicple that a user should be granted the minimum possible rights necessary to perform the job, Least Privilege, A complementary principle to implicit deny; can be challenging to get right.
A local user account is stored in a database known as the:, Security Account Manager, SAM is part of the HKEY_LOCAL_MACHINE registry; Each machine maintains its own SAM and set of SIDs for accounts.
page where account can be switched from MS to local or local to MS as preferred (in Settings), Your Info, Accounts->Your Info; 
command to show all Windows accounts, Net User, add; modify; or delete user accounts; and display detailed information about user accounts on a local computer or domain.
What type of authentication is a fingerprint or biometrics, Inherence, Something you *are*
The format of a credential is called an authentication ?, factor, knowledge; possession; inherence
what does 2-step verification generate when user try log in?, soft token, also referred to as a one-time password (OTP).
QR Code stands for what?, Quick Response, A common tool for registering an Authenticator App with a service or network
FIDO stands for?, Fast Identity Online, A 'hard token' (smart card or USB thumb drive) for authentication is typically compliant with this standard.
What tab in AD User Properties do you configure a 'Home Folder' on?, Profile, Check 'Home Folder'; pick drive letter & enter the path.
what is \\<device name>\<share name>\<optional path> refered to as? (Acronym), UNC, Universal Naming Convention; used in Windows for different shared resources on the local network.
Quick run 'Active Directory Users and Computers', dsa.msc, (directory system agent) Or in Server Manager on the DC: Local Server->Tools menu
