DFS meaning (network)?, Distributed File System,  Files are accessible just as if they were stored locally; from any device and from anywhere on the network.
Linux: writes keyboard input to tty device for processing by the shell’s command interpreter, stdin, Basic 'File Descriptor' 0
Linux: reads data generated by shell (from tty device) and displays through terminal, stdout, Basic 'File Descriptor' 1
Linux: carries error information to display through terminal (generally), stderr, Basic 'File Descriptor' 2
Linux command to get comprehensive help pages for a command, man, or use --help after; '--help | more' will show one page at a time.
How to launch Nano so it shows file numbers (switch?), -l, nano -l filepath
How to save document in Nano?, ctrl-O
How to append text after the current position in Vi?, a, i will insert
How to append text at the end of the current line in Vi?, A, :q! to quit without saving
How to save and quit from Vi?, :wq, Add to delete an entire line
Specifies how the dirs under root should be named and where files should be placed (Acronym), FHS, Linuxes File System Heiarchy Standard
Linux command to print your current working directory, PWD, Print Working Directory - on some distros will show tilde ~ for home directory.
How to display directory contents long form in Linux, ls -l, -l is long form and -a is hidden stuffs
how to add line numbers with cat command in Linux?, -n, Often; cat output is piped to a pager ( cat | more or cat | less ) to control scrolling.
how to ignore case in a grep search?, -i, 'grep -i "uid=1003" /var/log/messages' for example
how to show JUST the match in grep search?, -o, -o "grep -rio perform.*WiNdoWs testing" (-r is recursive; . matches any character; .* matches any number of characters)
Linux: Change the Group on file 26 to MyGroup, sudo chgrp MyGroup 26, groupadd MyGroup to create MyGroup
Linux: Remove all permissions for groups and others form me.txt, chmod go-rwx me.txt, chmod -w document.pdf > removes write for everyone; chmod 755 myfile.txt > Owner: rwx; Group: r-x; Others: r-x
Linux find every item with full access from current folder:, find ./ -perm 777, Owner-Group-Others; also there is -name; -size; -user; -type (files; directories; block devices (disks); network sockets; symbolic links; named pipes)
how to make cp display copied files in Linux?, -v, cp -v /var/log/message* /home/david' copy all files beginning with message to /home/david
Linux: where is the list of accounts allowed to run sudo stored?, /etc/sudoers, The user might be asked to confirm his or her password if it has not been cached recently.
Linux: where are user settings stored?, /etc/passwd, And group settings are stored in the /etc/group; use 'getent passwd dave' to check if dave is there.
Linux: where are encrypted password hashes generally stored?, /etc/shadow, it's a secret to everyone
What numeric format are Linux can Linux permissions be expressed in?, Octal, The leading zero identifies the value as an octal but can often be omitted. (eg. 0754)
What are the numeric values for Read; Write and Execute in Linux (nospaces), 421, Read = 4; Write = 2; Execute = 1 and Deny = 0 (add em up for the permission)
What Linux packages does APT work with?, deb, Advanced Packaging Tool (apt/apt-get) is used by Debian distros / .deb format packages.
What Linux packages does YUM work with?, rpm, Yellowdog Updater/Modifier (YUM) is used by Red Hat distros / .rpm format packages.
Refresh the local database with info about packages available (apt-get), update, Gets latest package lists from repositories
Refresh the local database with info about packages available (yum), check-update, Gets latest package lists from repositories
Update all packages with the newest versions (apt-get), upgrade, Downloads and installs newer versions of currently installed packages
Update all packages with the newest versions (yum), update, Downloads and installs newer versions of currently installed packages
A Linux Intrusion Prevention System (IPS) they mention, Snort, Detects and blocks suspicious traffic by analyzing packets using custom rulesets
Use apt to install samba and skip confirmation prompts, sudo apt install samba -y, or sudo apt install -y samba
A Linux Antivirus they mentions, Clam, ClamAV scans for viruses and malware; often used on mail servers or to check files manually
Linux command that displays dynamic process status; reflecting real-time changes, top, M = Sort by Memory / P = Sort by CPU / u = Sort by User / N = Sort by PID desc / Enter = Refresh / q = quit
Linux: Sort 'top' processes in decreasing order of PID?, N, PID 1 is allocated to the initial daemon; which is the first process to start and is the parent of all other processes on the system.
Linux: Sort 'top' processes by memory usage?, M, Enter will refresh; 'u' will Display processes belonging to the user specified at the prompt.
Linux: sort 'top' processes by CPU usage?, P, Enter will refresh status of all processes.  Or try htop for a fancier color version.
Linux: exit the 'top' process list interface?, q, E changes units to use in upper Memory values; e changes units to use in lower process list view.
Linux: display a quick list of any 'terminal' processes in user-oriented, ps au, ps aux will show all processes even those without a tty or pts so it's bigger
Linux: Display processes belonging to the user specified at the prompt?, u, top -u username when you run it; or it will prompt you when you hit u
Functions used for making a cryptographic hash of the compiled package ?/?/?, MD5/SHA-256/GPG, GPG=GNU Privacy Guard; The hash value and function are published on the package vendor's site.
Linux command to display all Network Adapter/IP info cleanly in terminal, nmcli, nmcli device show / nmcli connection show for info about devices & connections
Linux: take connection eth0 down [via Network Manager command], nmcli connection down eth0, Network Manager settings in '/etc/NetworkManager' instead of '/etc/network/interfaces' historic setting.
Linux: what legacy tool did the 'ip' command replace?, ifconfig, ifconfig is part of the net-tools package; now replaced by the iproute2 package
Linux: Modern network management package that can be operated using a GUI or the nmcli tools, NetworkManager, Alternatively; a network configuration might be managed using the systemd-networkd configuration manager.
Linux: Show only eth0 with 'ip' command, ip addr show dev eth0, The command 'ip addr' replicates the basic reporting functionality of ifconfig
Linux: Add an IP address 10.0.0.3 to eth0, ip addr add 10.0.0.3 dev eth0, and 'ip addr delete 10.0.0.3 dev eth0'
Linux: Show status of interfaces WITH STATISTICS?, ip -s link, 'ip -s link' same as 'ip link' but adds Tx and Rx statistics (Send/Receive)
Linux: Use the 'ip' command to enable interface eth0?, ip link set eth0 up, 'ip link set {eth0} up|down' for example
Linux: compression utility besides 'tar', gzip, Beyond compression; Some examples of open-source backup products include Amanda; Bacula; Fwbackups; and Rsync.
command from iproute2 package that replicates the basic reporting functionality of ifconfig, ip addr, show the current address configuration; though ifconfig is nicer (net-tools package)
Historically edit this Linux file to modify Persistent network config, /etc/network/interfaces, you would bring interfaces up or down with the ifup and ifdown scripts
Linux: good tool for gathering information and testing name resolution, dig, (dig domainname); 'dig @server domain' will resolve the domain name against the DNS server specified by @server.
Linux (SMB)–compatible file sharing protocol, Samba, Samba enables the integration of Linux and Windows systems. Linux WS -> Windows Server / or vice-versa.
How to review a users cron jobs?,crontab -l, to remove jobs from the scheduled list use -r; to launch the editor use -e
How to remove a users cron jobs?,crontab -r, this will nuke all the jobs; [*/20 * * * * /home/basinx/Documents/testing/copy_hidden.sh] example
What is the Linux task scheduling service called?, cron, Every user of the system is allowed to schedule programs or tasks in their own personal crontab (cron table).
Linux: display all processes/show user/include procs not tied to terminal/extend output & wrap, ps auxww, or just use a single w if you do not want it to wrap.
MaxOS: quickly bring up 'Spotlight Search', command-space, Find almost anything on macOS with Spotlight Search. (or click the MAGNIFYING GLASS in the menu bar)
What shell does macOS use? newer/older, zsh/bash, Z shell (Catalina and up)/ Bourne Again Shell (older).
MacOS: Window management and multiple desktops, Mission Control, Activated with the F3 key
MacOS: hotkey to switch desktops, control-dir, ctrl-left or ctrl-right / 3-4 finger swipe OR hit F3 and choose a desktop
MacOS: key closest in function to the windows CTRL key?, COMMAND, and OPTION is usually mapped to ALT
MacOS: key that is usually mapped to ALT?, OPTION, and COMMAND is closes in function to the CTRL key
MacOS: What preference panel to change 'Magic Mouse' setting?, TrackPad, also you can change 'Magic Trackpad' options here; obviously
MacOS: Options to make the display adapt to ambient light conditions, Night Shift, In the "Displays" prefpane.
MacOS: What is the Narration option called?, VoiceOver, In 'System Preferences->Accessibility': VoiceOver; Cursor Size & Motion; Zoom tools; Display Contrast; Font Size; Captioning
MacOS: Where to find 'Users & Groups'?, System Preferences, Also; sign in and out of your Apple ID using the button on the System Preferences home page.
MacOS: Where to find permissions for apps to use features (like camera etc..), Security & Privacy, also options for what what analytics/telemetry data and personalized information can be collected
MacOS: How to make 'Admin Approval' settings available, lock icon, click it and type password then you can do admin stuffs.
MacOS: Where to find 'Keychain Access' app to look at problems with Keychain?, Utilities, search box for web site->select password to change. check box "show password" & enter admin pass to see what is.
MacOS: Does the disk encryption (if wanted), FileVault, When disk encryption enabled; each user account must be configured with a password. Also store recovery key iCloud or seperate disk.
MacOS: Where do you find FileVault?, Security & Privacy, System Preferences->Security & Privacy; On the 'FileVault' tab.
MacOS: Where do you set what analytics/telemetry data is collected?, Security & Privacy, also App permissions such as features (Location Service; Camera) & data stores (Contacts; Calendar)
MacOS: Default amount of storage for a user on iCloud?, 5GB, This space is shared across all iCloud components and devices.
MacOS: How to install a downloaded app?, drag, After the app is downloaded; it will need to be dragged to the Applications folder to install.
MacOS: Where in System Preferences to set allow install downloaded Apps?, Security & Privacy, Select the padlock to make changes to the settings
MacOS: What does an installed application appear as?, .APP, In the Applications folder.
MacOS: Some antiviruses you could use ?/?/?, Avira/Avast/Sophos, will detect malware directed at macOS—and Windows viruses too
How to have a bootable Windows partition on macOS?, Boot Camp, allow you to install Microsoft Windows 10 on your Intel-based Mac
what 'portal' is used to push apps to a supervised macOS?, Business Manager, Platform Deployment guide covering device management at support.apple.com/guide/deployment/welcome/1/web
What prefpane do you set up 'Remote Disk' in?, Sharing, System Preferences->sharing; Then check box next to DVD or CD sharing.
Mac OS - indicator you need to attach external drive for Time Machine restore, dim tick, the backup drive needs to be attached to restore that item.
Mac OS - how to close unresponsive Apps?, COMMAND+OPTION+ESC, 'Force Quit' from the Apple menu or press COMMAND+OPTION+ESC
How get to Recovery Menu in macOS?, COMMAND-R, hold until Apple logo; select language; [Restore from Time Machine backup; Reinstall macOS; Get Help; Disk Utility]
Three properties of secure information? (first 5 letters of each) ?/?/?, confi/integ/avail, Confidentiality/Integrity/Availability >> Often refered to as the CIA triad.
Three parts of a network security assessment ?/?/?, vuln/threat/risk, Vulnerability/Threat/Risk
Security: The person or thing that poses a threat is called a threat ..?, Actor, Or a 'Threat Agent'
Security: The path or tool used by an attacker can be referred to as the, Vector, Attack Vector or Threat Vector.
A set of recommendations for deploying a computer in a hardened configuration, config baseline, Configuration Baseline: There are baselines for different operating systems and for different server and client roles.
all points a threat actor could try to use to infiltrate or disrupt the system, attack surface,  The basic principle of a configuration baseline is to reduce the system’s attack surface.
a class of software designed to detect non-compliant systems:, vulnerability scanner, A non-compliant system is one that has drifted from its hardened configuration.
Malicious code that can use a vulnerability to compromise a host is, exploit, Most software vulnerabilities are discovered by software and security researchers
A vulnerability that is exploited before the developer knows about it or can release a patch, zero day, These can be extremely destructive; as it can take the vendor a lot of time to develop a patch
Technique where the threat actor learns a password or PIN by watching the user type it, Shoulder Surfing, Despite the name; the attacker may not have to be in proximity to the target; could watch from far
Technique of closely following authorized person as they pass a security checkpoint?, Tailgating, Sneaky mans
Technique where attacker enters a secure area with an employee's permission?, Piggybacking, Maybe impersonate cleaning crew or say they lost their badge
an attack directed specifically against upper levels of management in the organization, Whaling, Upper management may also be more vulnerable to ordinary phishing attacks because of their reluctance to learn basic security procedures.
Put on a fake wifi to trick people and harvest credentials; what is called?, Evil Twin, Attacker might even use DoS the legitimate AP or put a fake captive portal to steal creds.
Threat: Attacker try learn about the configuration of network a& security systems via reconnaissance and research, Footprinting, gathering publicly available information; scanning network ports and websites; and using social engineering techniques
Threat actor (digitally) masquerading as a trusted user or computer, Spoofing, cloning a valid MAC/IP address/software or logical token; using a false digital cert; imitating a legitimate email; or social engineering
Threat: steal authentication token and use again to impersonate the original user, replay attack, This is a type of spoofing attack
Threat actor covertly intercepting traffic between two hosts or networks, on-path, An evil twin is one example of an on-path attack; previously called Man-in-the-Middle attack
Threat: refers to cutting the power to a computer or cutting a network cable, Physical DoS, You gotta get you hands dirty sometime
Multiple compromised systems launching a DDoS attack is called?, botnet, First 1 or 2 dev compromized (Command & Control / C&C) used to compromise 100's or 1000's
Linux: Where is the first fixed disk listed?, /dev/sda, the second would be listed /dev/sdb
A vulnerability that allows threat actor to inject script via text field on a web app, input validation, One of the most widespread vulnerabilities in web apps is failure to validate this input properly
Pass Attack: matches the hash to those produced by ordinary words, Dictionary, his dictionary could include information such as user and company names; pet names; significant dates; or any other data
Pass Attack: against one of every possible combination it could be, Brute Force, Longer and more complex passwords increase the amount of time the attack takes to run
XSS Meaning?, Cross Site Scripting, Exploits the fact that the browser is likely to trust scripts that appear to come from a trusted site. Often it is; but with malicious code injected.
Security: MD5 meaning (Just MD)?, Message Digest, An older HASH algorithm that is slowly being phased out.
Security: SHA meaning?, Secure Hash Algorithm, The newer hash algorithm mentioned in the course; SHA-256 is common (linux: sha256sum/sha512sum > create a hash of whatever)
In Key Exchange the phemeral symmetric cipher secret keys are also referred to as the, Session Keys, Temporary keys derived from the PMK; PTK (Pairwise Transient Key) - for unicast traffic between client and AP; GTK (Group Temporal Key) - for multicast/broadcast traffic
TKIP Meaning? (related to Wi-Fi security), Temporal Key Integrity Protocol, TKIP encrypts each data packet with a (stronger) unique encryption key. Key component of WPA(1) (now depreciated)
WPA2 uses the AES; what that means?, Advanced Encryption Standard, A cipher deployed within the CCMP (Counter Mode with Cipher Block Chaining Message Authentication Code Protocol)
WPA2: AES/CCMP replaces ?/?, RC4/TKIP, CCMP provides authenticated encryption; which is designed to make replay attacks harder. AES provides stronger encryption than RC4. CCMP provides better integrity than TKIP.
WPA3: AES CCMP replaced with AES ?, GCMP, WPA3 replaced AES-CCMP with AES-GCMP (Galois Counter Mode Protocol). GCMP provides better performance and stronger authentication than CCMP. GCMP adds built-in message authentication and is more efficient for high-speed networks.
In addition to other enhancements; WPA3 now protects..?, Management Frames, Management frames are used for association and authentication and disassociation and deauthentication messages between stations and access points as devices join and leave the network.
WPA3 even networks with no passphrase get protected now. Wi-Fi ? ?, Enhanced Open, any station can still join the network; but traffic is protected against sniffing.
Passphrase length for WPA2 PSK? #-#, 8-63, This is converted to a type of hash value; referred to as the Pairwise Master key (PMK); part of the 4-way handshake
Security: SAE Meaning?, Simultaneous Auth of Equals, Used in WPA3 Personal Authentication; generates Pairwise Master Key (PMK); replaces Pre-Shared Key (PSK)
Security: EAP Meaning (Enterprise/authenticates against a network directory)?, Extensible Authentication Protocol, enables systems to use hardware-based identifiers; eg. fingerprint/smart card readers for authentication; and establish secure tunnels through which to submit credentials.
Standard for EAP communications over a LAN or WLAN for port-based authentication, 802.1X, WPA2-Enterprise or WPA3-Enterprise: 802.1X defines using EAPoL(W) which wraps the EAP authentication messages.
RADIUS (R and A Mean?), Remote Authentication,RADIUS: Used for verifying the identity of clients before granting access to a network
RADIUS (DIUS Means?), Dial In User Service,RADIUS: Originally designed for dial-up but now used for centralized AAA over IP networks
TACACS+: first 3 letters?, Terminal Access Controller, Access Control System Plus. Often used in authenticating administrative access to routers; switches; and access points.
Single sign-on authentication and authorization service based on a time-sensitive; ticket-granting system, Kerberos, Kerberos allows a user account to authenticate to a domain controller (DC) over a trusted local cabled segment (port 88)
What is your main Kerberos authentication item called?, Ticket Granting Ticket, with this you can get specific 'Service Ticket's but they are time stamped for security! Time drift will make not work!
Coax port for cable on SOHO router use what connector?, F, It is the usual screw on connector you know for cable modem.
LAN ports on a home router are usually color-coded what color?, Yellow, Usually but not always
First thing a SOHO router will ask you to do after you connect from a PC?, change password, Change the Default Password to secure the administrator account
SOHO Router Setup: Minimum characters considered a strong password?, 12, Changing the default username is also a good idea if possible.
firewall downloads curated rep. DB's that associate IP addy ranges; FQDNs & URLs with content and bad shit, Content Filtering, Most home routers do this instead of 'packet filtering' which can block based on source and destination IP filtering.
Type of port forwarding where the external port is forwarded to a different internal port, Port Mapping, Like if you had two PC's running servers on port 8181 you'd want two external ports to distinguish them
When firewall detects outbound on a certain port (to an IP) it allow inbound on dif port (from that IP), Port Triggering, Used to set up applications that require more than one port.
Do this after changing password and verifying WAN access on new SOHO router, firmware update, This is important to mitigate risks from software vulnerabilities
physically restricts access to one person at a time at entrace, vestibule, where one gateway leads to an enclosed space protected by another barrier
often deployed at airports and in public buildings to identify concealed weapons or other items, Magnetometer, can be hand-held or walk-through
Much more difficult to clone than ordinary swipe cards ?/?, smart card/key fob, all of these are considered a 'hardware token'
Biometric door lock that (usually) uses a small capacitive cell?, Fingerprint, moisture or dirt can prevent readings; and there are hygiene issues at shared-use gateways
Biometric door lock: camera-based scanner that uses visible and/or infrared light, Palmprint, Unlike facial recognition; the user must make an intentional gesture to authenticate.
One of the most accurate forms of biometrics, Retinal, Expensive and the process is relatively intrusive and complex. False negatives can be produced by diseases such as cataracts.
Used with a cable tie to secure a laptop or other device to a desk or pillar, Kensington Lock, Like those metal wires that connect to laptops you see
Prevent the covers of server equipment from being opened ?/?, Chasis Locks/Faceplates, These can prevent access to external USB ports and prevent someone from accessing the internal fixed disks.
control access to servers; switches; and routers [key access or electronic lock], Lockable rack cabinets, for equipment installed in standard network racks.
Manually triggered by staff using wireless pendant; concealed sensor or trigger; or call contact, Duress, electronic entry locks can also be programmed with a duress code that open gate but alert security
Alarms that use Radio frequency ID (RFID) tags and readers, Proximity, This can form the basis of an alarm system to detect whether someone is trying to remove equipment
Alarm based on either microwave radio reflection (eg. radar) or passive infrared (PIR), Motion, Passive Infrared detects moving heat sources. A motion-based alarm is linked to a detector triggered by movement within a room or other area.
Sensors in Motion-based alarms use what technologies ?/?, Microwave/PIR, Microwave radio reflection ( radar; for example) or passive infrared (PIR); which detects moving heat sources.
Alarm that would block a door or window opening or by a fence being cut, Circuit, when the circuit is opened or closed; depending on the type of alarm.
The final and probably easy to overlook aspect of physical security?, Lighting, Make building seem more secure and let security and cameras (even facial rec) work better
Typically a second layer of security designed to improve the resilience of perimeter gateways, Video, older-style CCTV (closed-circuit television) or with IP cameras; may work with facial or motion as well
Reinforced cement/metal pillars around a building, Bollard, Prevent criminal or terrorist attack from running vehicle into building; that kind of thing
where a threat actor is able to access a computer that has been left unlocked, Lunchtime Attack, Policies can configure screensavers that lock the desktop after a period of inactivity. Users should not depend on these; however.
Fast lock the desktop in Windows!, Win-L, Users must develop the habit of doing this each time they leave a computer unattended.
A clean desk policy ensures that *what?* (and Passwords) are not left in plain sight, PII, personally identifiable information: Paper copies of personal and confidential data must not be left where they could be read or stolen
control what system configuration changes a user can make to a PC, rights and privs, Configuring rights or privileges is the responsibility of the network owner.
Any use of the default administrator account must be logged and accounted for and generate?, Alert, If the default administrator account cannot be disabled; it must never be left configured with a default password.
Why would the normally disabled guest account in Windows be enabled?,  passwordless file sharing,  in a Windows workgroup
Where to unlock a user account in their active directory properties? (tab?), Account, in the Active Directory Users and Computers (dsa.msc)
How to reset user password in the Directory System Agent?, Right Click, Right click the user and choose Reset Password
Four important security account policies? (One word representing each), times attempts timeout logins, Restrict Login Times / Failed Attempts Lockout / Use Timeout & Screen Lockout / Concurrent Logins Rules
Logical security technologies designed to prevent malicious software from running on a host, Execution Control, (regardless of what account privileges allow); a security system that does not entirely depend on the good behavior of individual users.
